dog_whistle_root,n_canonical,canonical_forms,n_occurrences,ingroup,definition
single parent,4,single mom | single mother | single parent | single-parent household,103,racist,"Blaming Black parents (especially women) for poverty, crime, and dependence on public assistance"
Skittle,2,Skittle | Skittles,12,Islamophobic,Muslim person
Skype,2,Skype | Skypes,19,antisemitic,Jewish person
snowflake,2,snowflake | snowflakes,132,anti-liberal,liberals
social justice warrior,4,SJW | SJWs | social justice warrior | social justice warriors,720,anti-liberal,liberals
Sonnenrad,3,Black Sun | Sonnenrad | Sunwheel,35,white supremacist,White supremacist signal
soy boy,5,soy | soy boy | soy boys | soyboi | soybois,232,anti-liberal,liberal or establishment Republican men
special interests,3,global special interests | special interest | special interests,6,antisemitic,Jewish interests
SPQR,1,SPQR,7,white supremacist,White supremacist signal based on phrase associated with Roman Empire
states' rights,1,states' rights,7,racist,Racial segregation
steroids,1,steroids,5,transphobic,Trans people are drug abusers
strapping young buck,2,buck | young buck,23,racist,young Black man
string puller,3,string puller | string pullers | string-pullers,26,antisemitic,Jewish people who control the world
superpredators,4,super predator | super predators | superpredator | superpredators,55,racist,Black men are threatening
surgical wound,2,surgical wound | surgical wounds,38,transphobic,Trans woman's neovagina
SWPL,1,SWPL,10,anti-liberal,Politically progressive white person
take back,3,take back | take back our country | take our country back,55,white supremacist,Give white Americans back full social and political control over the country
the goyim know,3,da goyim know | shut it down | the goyim know,29,antisemitic,Jewish people control the world
thin blue line,2,thin blue line | thin blue line flag,12,racist,Protect white people from non-white people
Three Percenters,3,3%ers | III%ers | Three Percenters,31,white supremacist,Far-right militia movement
three strikes laws,3,three strikes | three strikes law | three strikes policy,27,racist,Mass incarceration of Black people
thug,2,thug | thugs,53,racist,Black men are criminals or violent
tiny minority of men,1,tiny minority of men,4,transphobic,Trans women
tough on crime,1,tough on crime,12,racist,Mass incarceration of Black and Latinx people
Trans Identified Female,5,TIF | TIFs | Trans Identified Female | Trans Identified Females | trans-identified female,63,transphobic,Trans man
Trans Identified Male,5,TIM | TIMs | Trans Identified Male | Trans Identified Males | trans-identified male,109,transphobic,Trans woman
TRAs,6,TRA | TRAs | trans activist | trans rights activist | trans rights activists | trans-rights activist,90,transphobic,person who supports the transgender rights movement
Trilateral Commission,1,Trilateral Commission,2,antisemitic,Institution by which Jewish people control the world
triple parentheses,5,((())) | (((echo))) | echo | triple brackets | triple parentheses,52,antisemitic,Symbol used to identify and harass Jewish people online
troon,2,troon | troons,94,transphobic,Trans person
two lightning bolt emojis,1,⚡ ⚡,1,white supremacist,White supremacist symbol representing the insignia of the Nazi SS
uterus-haver,3,uterus haver | uterus-havers | vagina haver,21,transphobic,"Either trans women are not women because they don't have a uterus, or that trans people are trying to reduce cis women to reproductive organs"
vaccine safety,1,vaccine safety,33,anti-vax,Opposition to vaccines
vegan cat,1,vegan cat,5,transphobic,Trans children were brainwashed by their parents
Vinland,1,Vinland,6,white supremacist,White supremacist signal referencing short-lived Viking settlement in North America
voter fraud,3,fraudulent voting | voter fraud | voting fraud,77,racist,Disenfranchisement of minority voters
war on Christmas,1,war on Christmas,2,conservative,America is a country for white Christians and only white Christians
war on crime,1,war on crime,2,racist,"mass incarceration and disenfranchisement of racial minorities, particularly Black men"
war on drugs,1,war on drugs,15,racist,"Harsh punishments for Black people who use drugs, but not for white people"
war on terror,2,war on terror | war on terrorism,8,Islamophobic,War on Arab and Muslim people
we wuz kangz,3,we wuz kangs | we wuz kangz | we wuz kings,37,racist,mocks claims of black nationalism by using mock AAVE
welfare,2,welfare | welfare reform,75,racist,racial minorities receive government aid that they don't deserve
welfare cheats,2,welfare cheat | welfare cheats,17,racist,Black people who are lazy and take advantage of government social aid
welfare queen,3,the welfare queen | welfare queen | welfare queens,52,racist,Black woman who are lazy and take advantage of government social aid
White Lives Matter,2,WLM | White Lives Matter,32,racist,Black lives don't matter
Willie Horton,1,Willie Horton,10,racist,Convicted murderer whose imagery is used to link blackness with criminality and threat
windmill,2,windmill | windmill of friendship,5,white supremacist,a swastika (aka I am a white supremacist)
womanface,1,womanface,8,transphobic,trans people treat womanhood as a costume
womyn,2,womxn | womyn,27,transphobic,cis women
working class,6,working class | working class communities | working class families | working families | working-class | working-class communities,93,racist,white working class
XX,1,XX,13,transphobic,I am a transphobic cis woman
Yahoo,2,Yahoo | Yahoos,3,anti-Latino,Hispanic person
YKW,2,YKW | you know who,11,antisemitic,Jewish person
YWNBAW,1,YWNBAW,8,transphobic,trans women are not women
Zionist,4,Zio | Zionist | Zionists | Zios,88,antisemitic,Jewish people
Zionist Occupation Government,3,ZOG | Zionist Occupation Government | zog,87,antisemitic,Jewish people control the world
